pid,text
R_4gTwmzU00VQzFGG,"I would feel frustrated. I needed support moths ago when i was originally booking. It is nice that they want tohelp but frankly this timing is just undermining the original plan, showing little trust in my planning and the persons actions are not supportive as they didnt provide an alternative option. I would respect the input a bit more if it seemed like they were genuinely trying to help and provideconstructive feedback not doubt. I would tell them that iu appreciate their concern and hear them however i did do my own research and have seen lots of positive feedback from trusted food critiques, i would essentially try to reassure them of my choice and suggest that we just give the place a try and if we really catch a bad vibe we can pivot then, especially given the timing. I would trust my research as i am sure i would have looked into many places and chosen the one i trust and think looks best."
R_9SrwGFpW1NuWcTL,My immedaite emotional response would be anger and fustration as friend A did not contribute to help. I would tell Friend A it would be too late to find another venue and call him useless and how he would be no position to have a say. I would call him lazy and stupid for looking at food reviews and if he was so picky to go pick himself. I would not trust a food review that states food poisoning and trust a critic more.
R_4mlxyaZfyHqzoIs,"Friend A should have brought these concerns up when we were discussing options, it is now too late. I would say to friend A 'you shiuld have been more involved and your laziness has affected the decision making, it should'nt be solely up to me'. I am trusting the numerous reviews saying the restaurant is good rather than 1 instance of food poisoning, this is not cause for concern yet. Google reviews are not always truthful anyway. I would look at the reviews myself and see if they are legitimate and also look at when they were written, this could be old information that has since become a non-issue. I decide to keep the booking, there is not enough cause for concern, i have paid a deposit, and there is not enough time to find a new location. If the food is off we can leave and improvise a new plan."
R_9D0H2cidGGIgHTk,"When I first saw Friend A’s message, I felt frustrated and anxious. After all, they ignored my messages when I asked for help, and now, just three hours before dinner, they suddenly raise concerns. My immediate thought was, “Why now?” especially after I already paid a non-refundable deposit. I would probably respond by saying, “I understand your concern, but I wish you had brought this up earlier. We’re very close to the dinner time, and it’s too late to make major changes.” To decide whether to trust the reviews, I’d compare the dates of the negative and positive reviews. If the food poisoning claims are recent and repeated, that’s a red flag. But if they’re old or seem exaggerated, I’d trust the food critics and my original decision. As an extra step, I might call the restaurant to ask if they’ve had recent complaints or check social media for any mentions. In the end, I’d likely keep the booking. The restaurant has great reviews from reliable sources, and changing plans now would be too risky and stressful, especially since most other places are fully booked."
R_4ps1aBwfiUlBGgw,"A. Are you kidding?!? first you stop helping me plan and now you're gonna critic my choice, even tho you had no decency to even attempt to help me. I have also paid a nonrefundable deposit for this, ugh! is honestly so annoying and lowkey disrespectful. B. Sorry but I already paid the deposit and the reviews from food critics say it is a really good restaurant. If you had said before I booked we definitely could have changed, but it's bit late now. C. I have already chosen and the fact I had to pay a deposit shows this restaurant is quite fancy compared to others, I feel like it is quite this restaurant would not have food poisoning. D. no, once my mind is set. It is set and the food critics prove that it sounds like a good restaurant and unlikely that there would be food poisoning."
R_3nIZ7fgaHieiBpZ,"Concerned because any reviews that say food poisoning is pretty worrisome, even if there are great reviews so id check the reviews again myself because friend A might be looking at the wrong thing. Id tell Friend A that ill check it again myself and to just wait till I finish doing so and to look for another restaurant in the area just in case. IF the bad reviews are real id leave and if they aren't stay and tell friend A that they're stupid and merrily go eat altogether. I can only make sure if I see the information with my own eyes and as Friend A did ghost the messages before id be more skeptical but not mad."
R_43bHQ8gIy43Qqn7,"A. A little disappointed that my money got wasted, but it's overall fine. B. Ask if he has any other options in mind C. I would keep to myself that it most likely is selection bias, as there probably is a small number of people who got food poisoning compared to the general consumer. D. Maybe I would explain that to him about the small amount of reviews, the booking will be kept until an alternative resturant is found."
R_41jSm6yTj5RoCxr,I would feel confused and worried about what to do next. However I would probably tell them that we should still go anyway as there isn't much we can do 3 hours before. I would trust reviews from food critics as they would have more experience and could provide trustworthy detail. I would probably call Friend B and ask her for her opinions. I would finally chose to keep the booking because I have already paid for it and I wouldn't want it to go to waste.
R_9VNIBkBFb8rdq4G,"My immediate reaction is disappointment at the lack of clearance or correspondence regarding their disaffection towards the choice of venue. The first statement I would make is ""You haven't given me enough notice, this is non-refundable"", as well as ""Please consider these reviews and available evidence"". To decide trustworthiness, I would consider the merit/rationale of the argument, the source's credibility, as well as the context of the evaluations. An extra check I would make is to run the reviews through an ""AI review"" detector or check if the business has a coercive review scheme. My final choice is to keep the booking."
R_9i3WqkbyXzPIOUM,"A. my immediate emotional reaction to Friend A's late response is frustration. B. I would tell Friend A about the non-refundable deposit and food critic reviews and that their response was way too late - shouldve mentioned before i booked C. While I do trust Friend A's reasoning, I would double check google reviews for the restaurant to gauge how reliable/severe the food poisoning allegations are. D. Negotiate with Friend A to stick with the initial restaurant I would keep the booking due to the lateness of Friend A's response, the non refundable deposit and the counter-argument of great food critic reviews to the food poisoning allegations"
R_4Pk4ukh82fcM9bX,"A. disappointment and resentment, why did they not help to find a restaurant and just now decide to input their opinion? Especially when it is clearly not helpful anymore as its too late B. Where else should we go instead? I checked earlier and this one had good reviews C. Search it up, my friends information could be wrong, might as well double check D. I would check what my friend B likes to eat or just decide to go to the original restaurant I picked"
R_9hAOLp1N0EAyxFO,"I'd feel slightly annoyed that they only responded 3 hours before but also concerned as to why they'd stopped replying and only now decided that we should potentially cancel. I'd try to reassure my friend that there are only a few instances in which the food poisoning happened, and also let them know that I've paid a non-refundable deposit. I think that I would trust the information provided by food critics but would also validate my friend's concern regarding food poisoning. I'd double check if there are any other options available so we could potentially eat elsewhere, and if not keep the booking."
R_9dRnGUVSL6lM6hl,"When I saw Friend A’s message, honestly, I just felt a bit annoyed. We were supposed to plan this together one month ago, but he didn’t even reply to my texts. Now, only three hours before dinner, suddenly he sends me some screenshots about food poisoning at the place I booked. First thing I think is, “Why bring this up so late? I already paid the deposit and most places are probably booked out now.” I text Friend A back, “Why are you only saying this now? This place has a lot of good reviews, even food critics recommend it.”I don’t really trust random bad reviews online, because anybody can post them, maybe not even real customers. Most of the feedback for this restaurant is pretty good.But I still double-check. I search the restaurant’s name on Google again and look for any news about serious problems or health issues. If it’s just a few bad reviews and the experts say it’s good, I think it’s fine.So finally, I decide to keep the booking. Too late to change plans, and I don’t see real proof that it’s dangerous. It just feels more practical to stick with the original plan."
R_41ZtrfyfjJVGLwO,"The first emotion i feel is annoyed. I am not annoyed at that they found bad reviews on the restaurant I chose because that is a valid finding, however, I am annoyed that they responded late and do not have an alternative option reserved. In saying so, I would ask then first why they didn’t reply to me earlier. I want to understand their point of view and what they are going through before making any judgements about them. Then I would push us to both proceed us to find a new restaurant, but Iwnoukd ask them to pay half of the deposit that I set aside it is only fair."
R_9uK9OU4Zgkx3Pxv,"I'm immediately very frustrated and annoyed with friend A because they didn't help find the restaurant when they were supposed to and were rude enough to not respond to my messages, so they don't get to change the plans or have an opinion at this late stage. I'd say ""well, I've already paid the deposit and the reviews I've read are all glowing so we should still go, unless you'd be happy to reimburse me for the deposit"". Google reviews are anonymous so they're much less likely to be legit, while food critics are likely to be honest as they have a reputation to uphold to sustain their career. I would check all of the other google reviews before proceeding to see if any of them mention food poisoning. I would keep the booking as risk of food poisoning is low and probably was a one-off for that person who posted the google review, plus I don't want to lose my deposit money."
R_4K6A3cW1Y4DCpEZ,anger because why do you only care 3 hours before the booking when i had asked 1 month ago. agitated too. since i am non confrontational i would tell them to look for other options since i am currently busy and say that i missed those reviews when i was booking to mitigate any blame on me. I would say i am busy even if i wasnt because i already out the initial effort and they were unresponsive so it is there turn now. i would verify the google review. but also it could just be that one persons luck but to ensure i dont get blamed id be extra cautious. I would change my plans to avoid the possible drama of the other person saying i am negligent in my restaurant search.
R_45sFQ1KiRZd5vcZ,"My immediate gut reaction was mostly like an ""are you serious"" response. I definitely though of how is friend A and actual friend of B. I would defintely say to friend A that ""whats wrong with the restuarant? Just because one google reviever says that they got food poisoning, doesn't mean that the restaurant is bad. You didn't even respond to my texts, nor you didn't even help me out with finding a place ofr friend B"" I decided that the great reviews from food critics is more trustworhty than friend A, as they also only had one screenshot, versus many reviews from food critics. I would check the reviews of the restuarant again, and I would keep the booking as Friend A's argument is not valid to prove that we shouldn't go to that place. Furthermore, I want to be considerate fo Friend B as it is their birthday."
R_9EAyjcuzWwlSWsB,"I would feel very disappointed at the thought of having to cancel a nicely prepared dinner reservation for Friend B. I would tell Friend A that this restaurant has really good views and the food poisoning situations may not directly apply to this restaurant, as well as having paid for the reservation. I would ask Friend A what source she is receiving food poisoning information from in case it is just lies for bad reviews on certain restaurants. Further actions I could take would be to show her pictures of the restaurant's reviews and to find any reviews of food poisoning."
R_98LIgzqqTXmkhm0,"Initial reaction would be frustration and disbelief. They did not help with the process of deciding which restaurant to book nor did they help in paying the deposit. They only check 3 hours before the dinner starts to say we shouldn't go without even offering an alternative. I'd view them as impulsive, reckless and quick to judge. I'd respond that it's too late to change, that if they had a problem they should've said so sooner. I'd mention that i had already paid for the deposit and point out not all reviews talk about food poisoning and point out my own reviews for the restaurant. Regardless, i would listen to their worries about food poisoning and do some quick research on the reviews. What the customers who got food poisoning ordered so maybe we could avoid ordering the same. The frequency of food poisoning reviews and check reviews from other websites other than google to see if it's the same. That would help in the accuracy of the overall review of the restaurant, to see which is trustworthy. Overall, i would still stick with keeping the booking. I have paid for the deposit and i trust in my own research pointing the restaurant to be good. I am not someone who would cancel hours before."
R_4LUM6rz4IyYO7mN,"When Friend A suddenly texts me three hours before the dinner with screenshots of food poisoning reviews, my first reaction is frustration—why didn’t they help research earlier? I remind myself to stay calm and assess the situation. I compare the few negative Google reviews to the restaurant’s overall high ratings and professional critic endorsements, realizing isolated incidents don’t define the place. A quick check confirms most complaints are outdated or vague, while recent diners praise the food. Since canceling would mean losing the deposit and scrambling for a last-minute alternative, I decide to keep the booking. I’ll advise the group to avoid high-risk dishes and trust my initial research. If anything, Friend A owes me an explanation for disappearing—but for now, the birthday celebration goes on as planned."
R_4G3x7Ipdxkppf60,sometimes its bestto chekc if the restraunts website is legit as sometimes the websites themselevs can look shoddy look around and see the conditionis of the resteraunt and gauge if a normal person would find the atmosphere applealing. Check the reviws and see if the good reviws outweight the bad. If the bad reviews outweigh the good then it's safe to leave the restraunt as the good ffod critic reviews were probably fake and made by the resteraunt itself. ( Final plans leave: the risk of food poising is too big to risk on a friends birthday)
R_9QRrJIoDjaTtkjA,"1. should have told me your opinion earlier 2. reassure them that there were also great reviews 3. information straight from the sources, I consider the frequency of negative experiences, however if good reviews outweigh the bad significantly I stick to the good 4. should thoroughly check reviews and the other person's opinion prior to making the reservation"
R_4R8X3R31XZPpPUJ,"I would be extremely pissed and tell Friend A that maybe he should have said something earlier and actually contributed instead of commenting ONLY 3 hours before the dinner, either come or don't it's not my problem anymore. I would be disregarding his opinion and go anyway as I trust my research more and I would tell him off for being condescending and unhelpful. He did not put in any of the effort and only nudged for this near the actual deadline just three hours before the actual dinner, what say does he have compared to me, should have just kept his mouth shut. I would keep the booking plans."
R_9QD8SaZyhUCSZNv,I guess let Friend A choose and book a place if he thinks that place is bad. I would say that to him. C the chances of being poisoned is low. I would ask Friend B's opinion cuz its his bday
R_4xxzZCYZMQA1Fjg,"I think I'd tell them that if it has great review from critics then it'd probably be fine and people with bad experiences rant online more than people who have good experiences and i'd also say that there aren't any other places we could go to and we also already had a booking, and i'd think i take the information from the critics more so i would keep the booking because it's a confirmed booking rather then looking around and potentially not being able to get a booking"
R_9NVmMfCzK0yrrZn,"If the prerequisite is that he is my good friend, because my friends will directly tell me if they have any problems, so the reason why he no longer replies to my text messages is not just that. And I will believe his reminder about the restaurant issue, then I will immediately call the restaurant to confront and inquire about the specific situation and ask other friends who like to dine in various restaurants for their opinions about this restaurant, and then make a choice based on the situation. If I judge that it's okay, then I will continue to eat there and explain the restaurant's explanation to friend A. Or if the restaurant fails to convince me, I will choose to cook at home to celebrate my friend's birthday and either threaten to report them or ask for a refund of the deposit. If he is not the ""friend"" I consider him to be, then I will stop replying and not invite him to participate. The other procedures will remain the same as before."
R_9PAVCZ89IcvlfBk,"What a shit friend. Firstly, they didn't even bother to come up with an excuse for ignoring my messages and now they send this? Honestly they can just piss off since they didn't contribute anything to this plan. If they'd just responded like a decent person and helped me book a restaurant this issue would've been resolved much earlier. Nothing can justify ghosting me up until the day, especially since this was meant to be a team effort for Friend B's birthday. I'm texting back, 'maybe YOU shouldn't go because their is no 'we' in this plan,' then proceed to find the direct source of their screenshot. I did the research and none of them ever mentioned bad food practices or quality so I trust my own decision. I'm going to find if other sources have reported food poisoning because it'll most likely be on the news if a renowned restaurant, reviewed by many critics, gave their diners food poisoning. I'm going to keep the booking because it's a non-refundable deposit and I don't want to cancel plans last minute especially since it is a special occasion for someone else."
R_9nBlIRrmWhtjCPl,I would be extremely suspicious as the person agreed to the dinner in the first place and the fact that she is bailing would not make me happy. I would tell them that the place has great reviews and there is nothing to worry about. I would trust that the food is not poisoned as many other platforms would warn me about it but they didn’t. I would just go even if friend a wasn’t going because of the non refundable reservation.
R_4oIjFTLvhqtZ7UM,"What is wrong with Friend A? How are they not going to help at all then have something to complain about. My response would be ""Hey, so you actually ghosted me when I was looking for restaurants for Friend B. Since I've already paid a non-refundable deposit, unless you are willing to cover it, I think it would be best to just go. If you don't feel like coming, please don't."
R_9zvj7mgXc2CCZKn,"I would be resentful towards Friend A and argued for reasons they left me unread. I would say, ""Not my problem, already paid for it. You don't have to come if you have such low tolerance,"" to Friend A. I would prefer not to listen to what the critiques say and go try the restaurant myself. I would be more careful when ordering the food but still go with my preference and what others wanted too. I would rather confirm twice with Friend B because it was their birthday after all, and not me and Friend A. If Friend B was okay with the booking, then I see no issue to cancel the plan out, whatever. I would probably not going to talk with Friend A that night until later day. If Friend A recognise their fault, they should apologise and explain in detail what was going on with them."
R_4kppi5Tsg3rTVkZ,"I feel really angry, because A didn't respond my message when we had to find and choose a restaurant. I made all staffs by myself and paid the deposit, but A told me we shouldn't go 3 hours before the booking time. I will say to A: why don't you tell me this when I ask for your opinion? yes, I also think we shouldn't go after I read your message, but I already paid the deposit and it un-refundable. what do you think we should do now??? I decide trust A's information, because I don't want take we into a risks. I'll change plans, but I'll ask A to make a new plan and tell B what's happened."
R_4lLa3jvZvd4lVpy,"Should probably avoid restaurants with cases of food poisoning. Although, being a very good restaurant with good critic reviews, the chances of it happening again are low and the non-refundable deposit has already been paid. I would tell this to Friend A. The news source could also be untrustworthy. Keep booking for these reasons."
R_4dudAjdABDb7Msl,"Are they really sending this message now? They weren't trying to help me a month ago. I won't reply back with anything yet - I need time to think. I remember seeing that there were great reviews from food critics from this place. I should check when these negative Google reviews were made. I did pay a non-refundable deposit though, so unless I find out that the reviews were recent or a common experience, I will keep the booking."
R_4Oqsqm5fERNfAw0,"A. My initial reaction would me being a bit flustered at the response and feeling a bit mad at the sudden switch up in plans. I would also feel a bit angry as I was the one helping plan the outing a month ago, with friend B being unresponsive then and suddenly very responsive now about their opinions about the restaurant booking. B, I would text back in a calm but logical manner saying that their opinions are slightly last minute and that I have already paid a deposit for the booking. I would also tell them that the 'food poisoning' incident could have been a one off thing, or some random customers writing false reviews. C, I would trust the information of food critics, knowing the fact that they review restaurants as a career, and thus have creditable titles. D, Before we make a final decision, I would do a google search myself, about the reviews for the restaurant, and if the most recent reviews are rated on the higher side, I would text the friend and tell them this information. If it turned out that Friend A was right, where a bulk of the recent reviews for the restaurant were about food poisoning, then I would either just tank the deposit, or ask that friend to split the deposit (seeing that they were unresponsive about the celebrations a month ago, and that they still have some responsibility over the planning) - I would also do some quick searches for other restaurants. Overall, I would keep the booking, seeing that other nearby venues are full and it would be too last minute to change anything."
R_4erpfpI8p1ZfDah,id be annoyed at first and my first reaction would be disappointment and frustration. id remind friend A that they left me to book the dinner alone so its not really fair for them to have an opinion only three hours before the dinner. id tell them if they can find another restaurant and send me half the deposit i already paid then we can go elsewhere if they really want to. but id show them the great reviews from the food critics and stay confident with my choice of restaurant. ultimately i dont think there will be any other availability's in nearby restaurants so we will end up going to the one i initially chose.
R_9mZKOVSC49g5zX3,"My first instinct might have been something like, ""What? Are you serious? After I asked and got a silent response, and finally I had to make the decision all by myself after a month?"" I might have felt frustrated and doubtful. I might have said to A, but now there are only three hours left. If we need to look for a new restaurant now, we might not be able to find a suitable one. And did many people say that in your comment? Or was it just an exception? If it was an exception, it might be caused by reasons such as competitors or guests having poor digestion, etc. Or we could also check on the local health bureau government platform to see if there are any public information about this restaurant. This should be relatively authoritative information. And I heard that the food critics of this restaurant have very high ratings. If we can't confirm that we can't find a suitable restaurant, perhaps we could also try this restaurant. Finally, because of these official information, multiple comments from various sources, the costs we have already paid and that are irrecoverable, I decided to keep the reservation."
