pid,text
R_92XU34cSilT3AQN,"A. i would be a bit nervous because I don't want food poisoning, but i'd also be annoyed because she should have told me this earlier. i will tell her this. then i will look at the reviews myself. if there are many reviews about this issue, i will cancel, and ask the friend to split the deposit with me."
R_9RwGhSUWehXvsi5,"Initally I'd be really annoyed! Why on earth would you give this kind of info so near the time. I'd suggest that we take a look at more reviews and that I don't always trust these anyone, anyone only reports negative, no one responds positively to these things! Say let's go ahead with it, keep our fingers crossed it's OK and if not make it in to a fun night, somethign we can talk about. However, I would say, next time you're in charge of booking!"
R_4Y5S3VXplJ1LQNH,"I would be annoyed, and ask friend A to think about the larger number of food crtics that have positively rated the restaurant so it will likely be fine. I would also express frustration at friend A and ask them how they expect us to make plans when they ignored my messages for a month. I would also explain that theres a non-refundable deposit that was paid and that i would much prefer to keep the current reservation. If friend A is extremely reluctant, i would cancel plans entirely if they responded in a defensive manner when i called them out about their bad reply game and inconsideration for me and ask Friend A to pay half of the deposit. If friend A was understanding of my frustration, i would be happy to find somewhere else to go, but would also ask for half of the deposit. My first preference would be to keep the original reservation."
R_4aIWiOxJLzXshwJ,"My immediate reaction would be irritation and confusion - if Friend A didn't bother to choose the restaurant in the first place, why should they be picky about it now? It feels like they are being insincere too, since the restaurant has great reviews. Perhaps they simply don't like the choice - however, if they didn't, they should've brought it up with me prior. I would ask Friend A why they didn't bring it up with me earlier, as it's too late to cancel (including getting a deposit back). I would also ask if they have heard any negative things firsthand about the place. If not, I would explain my perspective and situation, and how I would want to keep the booking due to the investment of time and money I put in. I would choose in the end to keep the booking, but make it clear to Friend A that my choice is not because I don't trust their judgement, as I dislike hurting others' feelings through confrontation."
R_47BcUqTx8qqGiax,"When I received A’s message, my first reaction was frustration. I had asked for help a month ago, and A never responded—now they suddenly question the restaurant hours before the dinner? I felt a mix of anxiety and irritation, especially because I had already paid a non-refundable deposit. Still, I tried to stay calm. I searched online for the same reviews A mentioned. I found one report of suspected food poisoning, but it wasn’t clear if it was the restaurant’s fault. I also noticed that the restaurant still had many recent positive reviews, especially from food critics. That made me question whether A’s concern was based on solid evidence or just panic. I texted A and explained that I had already made the booking due to their silence, and changing the plan now would be difficult. I reassured them that I had looked into the reviews again and didn’t find convincing reasons to cancel. In the end, I decided to stick with the original plan. The restaurant still seemed trustworthy, and it felt unfair to change everything last-minute after all the effort I made."
R_44HKb6nrJlMLXVL,"A. I would feel quite frustrated considering that I have already done all the work. But overall I dont really care because I've already decided, and paid for it myself so they have no right to object. B. I'd say that its too late considering I've already decided, and that it shouldn't matter too much considering I have already done my part. What they found was most likely a fluke. C. I'd rather take information from critics and professionals rather than recent google reviews, or any low-rated google review for that matter, considering all restaurants have them. D. I would have researched for restaurants, depending on the vibe, look, food, and reviews from actual professionals. I would also check reviews from google, I just wouldn't nitpick on details in low rated reviews I would keep the booking because I already paid a non-refundable book, my friend responded too late, so I get to pick."
R_4G6rO6u8exqtpAV,"Wow. Seriously? Three hours before the dinner and now Friend A sends this? After ghosting me when I asked for help weeks ago? I’m honestly pretty pissed off. I’ve been stressing about this for a month, ended up booking it all myself, paid the non-refundable deposit — and suddenly they care? And about something they found on Google Reviews? It just feels a bit inconsiderate and honestly kind of cowardly to drop this so last minute. My first instinct is to snap back like, “Where was this energy when I needed help a month ago?” But I know that’s not helpful right now. I’d probably reply with something more composed like: “I saw that review too, but it’s one of like hundreds and most of them are great. It’s a bit too late to change now, but if you're really worried, feel free to sit this one out.” I’ll do a quick check anyway, just in case — scan the most recent reviews, see if that food poisoning comment is a one-off or part of a pattern. Maybe hop on the restaurant’s social media to see if they’ve posted anything weird recently. If anything seems seriously off, I’ll reconsider — but honestly, I trust the food critics more than some random angry Yelp user from two years ago. I’m keeping the booking. It’s too late to change plans, and the place still seems solid overall. It’s not perfect, but this is Friend B’s birthday, and I’m not going to let one panicked message ruin it. If Friend A doesn’t want to come, that’s on them."
R_4ZCEWgUy4gJ1QFO,"I would feel annoyed and call my friend an idiot for not saying anything in a month and cancelling 3 hours before. But there is always a solution so I would try to call the restaurant to ask if I could cancel the booking despite it already saying that its non-depositable. Restaurant says can cancel: i cancel, look for another place and call my mate for approval. If the restaurant says no: if the booking price was cheap like $50 or under, i would just book another restaurant and lose the money whatever. if it wasnt cheap, i would check how long ago this google review was made, whether it looks like someone credible had written it, look at their other google reviews. i would also check what other google reviewers have said about the restaurant. then i would text my mate and say it should be fine because the google reviewer looks stupid and all the other reviews say the restaurant is fine. if the friend still doesnt reply i will give them a call. if they dont pick up and they havent given a solution, then i will go forward with the dinner. if all of the google reviews say that the restaurant is bad, i will probably just sack the money and book somewhere else and tell my mate that they made a good call and apologise for not double checking the validity of the restaurant. theres too many factors to consider when making the final choice so idk"
R_9BJxT7iJnxHaxDr,"Oh no, I can’t believe this is happening just three hours before dinner. I’m honestly frustrated that Friend A is only getting back to me now, especially after ignoring my messages when I needed help planning. I already paid the deposit, and we don’t really have time to rebook somewhere else last minute. I’d probably text her back something like: “Where was this info earlier? I already paid for the booking, and the place has great critic reviews. I’ll double-check, but this is really late to raise it.” I’d also want to fact-check those reviews myself. Are those claims about food poisoning just a few one-star reviews? Or is there a pattern? I’d check the most recent Google and TripAdvisor reviews, maybe even the restaurant’s social media to see if they’ve posted anything or responded to complaints. If I can’t find solid proof of a problem, I’m inclined to go ahead. So my final choice is to keep the booking. It’s too late to make other arrangements, and there’s no strong evidence the restaurant is unsafe. I’ll ask Friend A to decide whether she’s still comfortable coming, but I’m not cancelling on Friend B’s birthday."
R_9YXG5Y4dTM4mSn2,"When reading Friend A's message that we shouldn't go, I would feel annoyed because they left the planning to me without any explanation, then wants to change the plans at the last minute when they can't exactly be changed. However I would try and put this aside, and ask them whether there's a lot of other good reviews on the site of diners who didn't get food poisoning. I would also ask when the reviews were posted, as if they were recent then I would ask Friend B if they're ok with still going to the restaurant, or if they'd rather go somewhere else since it's their birthday. I would also tell Friend A that we've already paid a deposit, and if they're unsure then we can order food that has less chance of causing food poisoning. If the bad reviews are old or outnumbered, then I would keep the booking. If the reviews are recent or there is a significant amount of them, then I would consult with Friend B and probably change plans."
R_9OBJ6XMuIvupbBT,
R_41tqrr81pmslC2o,"Ugh… seriously? Three hours before dinner and Friend A suddenly decides to bring this up? I’m honestly kind of annoyed that they completely ghosted me when I asked for help weeks ago, and now they want to chime in last minute? That’s frustrating and feels pretty unfair. I already paid a non-refundable deposit, and now this? I’d probably respond to Friend A with something like, “Hey, I get your concern, but I really wish you’d brought this up earlier. The booking is set and I already paid for it.” I’d try not to sound too angry, but I’d definitely be honest. Final choice: I’d keep the booking. The timing is too last-minute to make new plans, the deposit is gone either way, and I trust the professional reviews more than a few bad anecdotes. Plus, Friend B deserves a smooth and enjoyable birthday and stressing about this hours before won’t help anyone."
R_9MXiwwiMAMXAFTb,"Oh my god, why did that happen!? Superised, disappointed, and a little bit angry. What should I do now? Yep, i should check when that review posted. then, if it happened in the last week ,i will change the place quickly. but whether the time, ill go for telling her i paid a lot of money on the booking."
R_410cYNjEF8U3sUw,"Oh shit! Can't afford getting food poisoning. Not safe to take everyone. Can we shift the venue to some other restaurant? Let me go check the reviews by food critics, because that should be a reliable source."
R_41mv5PqgOB4V5eO,"My immediate reaction would be that Friend A simply doesn't want to go to the place I selected. Regardless of these reviews, she chose to ignore the good ones. Hence, it feels as if there are ulterior motives; she possibly wanted to act as a hero and 'outshine' me, to make a more favourable impression on Friend B. A lot of places do have bad reviews, and it's easy to avoid certain meals if you're paranoid. It isn't fair to discredit critics and a restaurant by only trusting a few Google reviews. If it was such an issue, she could have researched it prior before I booked and made more of an effort to find a place that she was also satisfied with. I could have made more efforts to read the reviews; however, I did see the critic reviews, which should suffice. I will keep the booking, as if there was an issue, she could have brought it up to me earlier rather than last minute."
R_9S8kFXSoliHXPI0,"I would feel frustrated as friend A has ghosted me for months but suddenly appeared and disrupting my plans. I would tell friend A that I have already paid deposit for it so there is no other option but go to the restaurant I have book. in deciding information that is trustworthy, I would read and compare the overall google comments and decide whether the restaurant is worth visiting. I would keep the booking. This is not only because of that I have paid a non-refundable deposit, but also the fact that a single comment of the restaurant has food poisoning might not be trustworthy. Moreover, friend A only rejected my plan but did not give out alternative solutions, giving me no reasons to change my plan."
R_9ErPXg9B4fMpOaU,"I would feel irritated as Friend A did not contribute to the conversation and only decided to abruptly chime in before the event. This lacks communication and implies their lack of consideration and care on behalf of others. I would tell them that it's non-refundable and we would have to attend as it's inconsiderate to change plans right before the event. I would offer an ultimatum, if friend A is able to find an alternative restaurant and pay their share (the full fee) of the booking, we could consult with friend B and find an alternative place instead. The chances of that it unlikely though as it's hard to negotiate and find alternative time and place again. In regards to the restaurants review, if the OVERALL impression of the restaurant is good then it's best to attend it either way. The likely hood of food poisoning is rare and it applies for EVERY restaurant. Personally, I would've stuck with the same booking if the Friend A isn't willing to pay for the full fee on the alternative restaurant."
R_4eWcXmeJCwN6sdV,"The situation would make me upset and angry with Friend A. I would see the situation as rude and inconsiderate, even if they didn't have that itention. Right away, I would probably send a rash message to Friend A because I would be frustrated and stressed. If i was really upset by the situation I would tell Friend A to sort it out themselves, however I may feel bad and wouldn't want to ruin Friend B's birthday. It would also depend how legit the food posining message was, like if it was from 5 years ago and no other messages that agree or say the same thing. If there were legit food critics that said the place was good, I'd be inclined to discard the bad reviews, also the deposit would make me think the resturant must be pretty nice/ fancy. I would probably ultimately ask Friend A what they would want to do, but if the despoit had to be paid I was ask Friend B to split it."
R_9zVyPAZgzVC56Yp,"we're still going to go to this restaurant. You didn't respond to my messages until 3 hours before we were going when we were planning it for a whole month. I would rather trust food critics whose job it is to judge food over some random person on google critics ""claiming"" to get food poisoning from their meal. Plus the surrounding restaurants are already full and I already paid for the reservation and can't get my money back. We're eating at this restaurant cause you haven't responded to my texts, there's no place else to go and I already paid for it and can't get a refund."
R_4X1cMCJsXh1khRi,"i'll be angry. friend A has all his time to simply respond to my text. and now he's complaining that we should not go. i'll look at the reviews myself. if the food poisoning reviews are not even that bad, i might think this is just another excuse from friend A for not wanting to go. i don't think i can stop myself from thinking badly of A since he gave me a bad impression in the first place. however, if the reviews are actually that bad, i will follow up if the government-related kitchen checks gave that restaurant a visit. If they had, the restaurant is probably still safe to go. if they have not, i might not go and let friend A decide on a restaurant himself. if friend A does not reply to my message again, i'll book a restaurant for just me and friend B, excluding friend A. I don't think friend A and my friendship will ever stay the same again."
R_4pzNbMaAStZDdZc,"I would definitely be frustrated receiving the message from Friend A. I think I would have to step back for a second before replying to make sure I didn’t say anything I would regret. Considering how late it is, I would guess that the deposit would be lost by this point, and therefore I would be losing that money if we didn’t go to the restaurant. It’s difficult to say whether or not the food critics or the google reviews are more trustworthy, so I think I would ignore the reviews entirely considering it’s so last minute. Ultimately, I think I would tell Friend A that we should keep the booking. I would tell them that if they wanted to have a look around for another restaurant then they were more than welcome, but they would have to help me pay for the deposit for the other restaurant. At the end of the day its most important that Friend B enjoys their birthday, but I would make it clear that I should not be paying for the last minute change of plans alone. If Friend A did not want to pay for the deposit, I would reiterate that we should then keep the booking."
R_4d0qm12JJ7lAD6Z,"i would be immediately pressed at friend A and text/speak to them passive aggressively asking why she couldn't have been so avidly researching before i made the deposit. considering that she is evidently not a trustworthy friend, she is likely an equally untrustworthy source and so i would confirm these food poisoning allegations myself. if they were true and from multiple sources/reviews, i would then ask her what she wants to do about the non-refundable deposit, heavily implying that i will not be paying for it entirely, actually this would depend on how hefty the deposit was. scenario a (hefty deposit): if she is kind enough to take on some of deposit then i would be happy to switch restaurants if there was one to her liking, otherwise i would snitch to any other friends involved/invited and probably keep the booking out of spite. scenario b (smaller deposit): i would be a kind gracious friend and start looking for restaurants with less health risks, hopefully find one and switch the booking"
R_98LEQQbG1QLjGs9,"The immediate reaction is annoyance/frustration, because Friend A didn't help me book the restaurant and it's my money he will waste by not showing up. First I'd ask him why he didn't respond to my texts initially, and I'd want a decent reason for that. I'd tell Friend A that we'd better go regardless of reviews as I've already paid and it's non-refundable. If he still doesn't want to show up, I'd ask him to pay me back half the amount. Deciding which information is trustworthy and which checks/actions to take is a little more difficult. I'd need to see whether the poisoning incidents were isolated to a certain period, whether or not the restaurant had responded to them, and I'd figure out which dishes the victims ordered and make a note not to get them myself. I'd also need to look at when the critic reviews were posted and the content within them, which dishes they rate highly etc. I'd tell Friend A that we could order based on this information."
R_439cnIgNhLdMTUI,"Immediately I would investigate into the google reviews tbat claim of getting food poisoning. Validity would be checked by the amount of reviews these individuals have given, how long ago these reviews were put and what other reviewers have said on google reviews. Following this, I would make a subjective decision whether the claims are valid right now. I would also check the reviews that have been given on other platforms, such as tripadvisor. If there is a pattern of a specific food giving food poisoning, then I would say to Friend A that we will just avoid that meal and order something else from there. If Friend A is still insisting on not having that restaurant, then I would tell them that the booking has already been made, and a deposit has been given. If they are willing to get a booking and take responsibility for finding another restaurant, then I am happy to change plans, else we will keep this booking."
R_4kM44HpIMuSFtsQ,"a) i would feel very upset. If they cared so much about the food we ate why didnt they suggest anything before. 3 hours before is too short notice, as as long as nothing isnt raw it should be fine. b) i would say; 'hey, i planned this by myself. Its too late to get anything else and i would have appreciated if you communicated this earlier. Next time please help me choose these plans to avoid this again' c) I just wouldnt care, i would just avoid meaty/ fishy foods d) I would just go with my restaurant, its too late. I would double check the reviews. Often people leave bad reviews if the service was bad and not if it was good. I would keep the booking. It is far too late to change any plans and Friend A was being irresponsible with my planning time. further, i was doing it out of my own free time, it doesn't have to be perfect"
R_9RvC2KWwEic82Dm,"I would immediately feel very frustrated and angry regarding Friend A's response, accounting for the fact that they did not respond or acknowledge my previous message that I had sent. In this situation, I would be very emotional and stressed considering the lateness of the response. In response to Friend A, I would start by mentioning how they had not offered any input or assistance of any kind; however, I would then ask Friend A if they would have any ideas or alternatives. To determine which source of information is most trustworthy, I would compare the number of negative reviews with the more positive reviews to gauge which is more prevalent. I would also check the dates of said reviews, seeing if the food poisoning review is outdated, as the restaurant may have made improvements."
R_4FxFPJXtfIewh7W,"immediate gut/emotional reaction of how it is not fair for friend A to be sending a message like that when it is so last minute. i believe that that message implies that we should go somewhere else, but it is already the day of and the booking has already been made. we had a long time to plan/discuss/research about where we should go, yet they didn't contribute, so they don't get the right to randomly get their two cents right before the party happens and we listen to them. I would say something along the lines of ""oh no that's not good, but i do remember looking at reviews before showing more positive responses, and its too late now to change venues"". i wouldn't really care about which information is trustworthy, i would still want to go to the restaurant that was initially booked, just out of spite of them (and their lack of work)."
R_41KlBJpdsWwJ4wV,"A. My gut feeling would be anger and annoyance. Frustrated by why the person completely ignored my texts when I asked for help booking, and now they suddenly swoop in with screenshots warning about food poisoning. Would also want to mention that they could’ve mentioned this when I was organising everything. B. Looking closer, the screenshots are just from random Google users. I know how unreliable those can be and there are chance that this might not even be related to the restaurant. C. I remind myself the restaurant has been praised by food critics, which holds much more weight. Still, I want to be sure, so I would check other platforms. D. No i wouldnt change my plan, just because some reviews were bad doesn't mean it will happen to everyone and plus at this point, changing plans would be chaos. Most nearby places are fully booked, the deposit is non-refundable, and there’s no convincing evidence this restaurant is unsafe. My decision: keep the booking. I’ll reassure Friend A and Friend B, explain the critic reviews, and move forward because one or two dodgy reviews aren’t enough to ruin Friend B’s birthday dinner."
R_4rVmGuGDOlDTrA8,"Oh my GOD, are you kidding me right now?! Three hours before dinner and NOW you decide to chime in? I'm honestly so frustrated. Like, where were you a month ago when I actually NEEDED your help? I had to find this place by myself, put down my own money for the deposit, and now you're trying to sabotage it last minute with some random Google reviews? My first instinct is to text back something sarcastic like ""Thanks for the 11th hour input"" but I need to think this through for Friend B's sake. Okay, let me look at these screenshots properly. Google Reviews can be unreliable - anyone can post anything. These could be fake reviews or just people having bad experiences that aren't representative. The food critics I read had actual credentials and probably more rigorous standards. I'm going to quickly check if these reviews show up on other platforms like Yelp too. If there's a genuine food safety issue, it would probably appear across multiple sites, right? I should also see if these are recent reviews. But honestly, what are my realistic options here? It's three hours before dinner - most decent places will be booked solid for weekend service. And I'd lose my deposit. I am keeping the booking."
R_4IcXnJCqG7enIII,"Seriously? Three hours before the dinner? This is the first time Friend A’s messaging me about this after ghosting me a month ago when I asked for help. And now they suddenly care enough to send Google Reviews screenshots? Honestly, I’m frustrated. I’ve already put down a non-refundable deposit and organised everything because they went quiet. Where was this energy when we were trying to plan? As I already paid the deposit and there are limited options left at this point. Also, most of the reviews I saw were positive, including from professional critics. I'll keep the booking."
