pid,text
R_4Qrr4Sxrf7MWyC0,"My first gut reaction after reading Friend B’s message is confusion and a bit of doubt. Part of me feels slightly anxious—what if Friend B is right and we’re making a mistake sticking to the original plan? But another part of me feels defensive, like, ""Wait, we already booked this for a reason; I shouldn’t just change everything based on one message."" Emotionally, I feel torn between wanting to trust Friend B (since they might know something important) and not wanting to overreact. If I had to say something to Friend A right away, I’d probably say, “Hey, B messaged me about this—do you think we should look into it? Maybe we should double-check before making a decision.” I wouldn’t outright cancel anything yet; I’d want to discuss it with Friend A first since we planned this together. When it comes to deciding what’s trustworthy, I’d think about how reliable Friend B usually is. Do they normally share accurate info, or do they overreact? I’d also check if they provided any evidence or if it’s just their opinion. If it’s something important, I might look online or ask someone else who’s been there recently. Before choosing, I’d definitely do some quick research—maybe check reviews, schedules, or official updates—and talk to Friend A about it. I wouldn’t want to waste money or ruin the plan based on a rumor. My final choice: I’d keep the booking unless I find solid evidence that changing plans is necessary. Right now, Friend B’s message alone isn’t enough for me to switch. But I’d stay open to changing if I find reliable confirmation."
R_4FEe0xLd6itwVFL,"When I received a text message from my friend A, I felt a little angry and helpless at the same time. A month ago, I contacted him to ask him to share the planning tasks with me, but he didn't respond at all. In the end, I did everything myself and paid the non-refundable deposit out of my own pocket. Now, with only three hours left before dinner, he suddenly pops up and says, ‘Maybe we shouldn't go.’ This really makes me feel unfair. The most critical issue is that changing restaurants at this point is extremely difficult. We booked quite late, and the popular restaurants in this area are likely already fully booked. Changing locations at the last minute could ruin Friend B’s birthday, especially if we can’t find a new place to eat. B has been looking forward to tonight, and I don’t want him to feel like we didn’t prepare properly."
R_4K2wWM1201O7BbJ,"Reserve your reservation. ​​ Reason The credibility of information is weighed: The generally high praise from professional food critics weighs far more than a few unverified, anonymous Google negative reviews (especially those that have been ""carefully"" selected). Urgency and feasibility: With only three hours left until dinner, it is almost impossible to guarantee finding a place of good quality and with a seat when changing locations at the last minute. The greater possibility is to cancel the entire celebration or end up in a worse restaurant. Sunk cost consideration: That non-refundable deposit is no small amount. It feels so frustrating to lose this sum of money for nothing after friend A gave up. The credibility of Friend A: His previous disappearance and lack of help, coupled with this sudden last-minute panic, make it hard for people to take his ""warning"" too seriously. Risk mitigation measures: We will pay more attention at that time - order thoroughly cooked dishes, observe the atmosphere of the restaurant, and avoid the high-risk foods mentioned in the comments. If others seem suspicious, I will quietly remind everyone."
R_2hBdnry1AtOl99m,"Oh no — my heart just dropped when I saw Friend A’s message. We’re only three hours away from dinner, and now I’m being told that the restaurant might have caused food poisoning? Seriously? After all this planning and stress — and especially after A completely ghosted me when I asked for help — this feels like a slap in the face. My first reaction is frustration. I want to text A something like: “You ignored me for weeks and now suddenly you’re worried?” But I need to stay calm and think this through. I know I can’t just cancel last minute without checking the facts, especially since we’ve already paid a non-refundable deposit. I’ll start by looking at the Google reviews myself. Are there multiple recent reports of food poisoning or just one or two random comments? I’ll also check the dates — maybe the issue was months ago and already resolved. Then I’ll search the restaurant’s name in local news or social media to see if anything serious was reported. Given the restaurant’s strong reputation with food critics and how late it is to find alternatives, I’m leaning toward keeping the booking. But to be safe, I’ll call the restaurant directly and ask if they’re aware of any recent complaints. If they’re transparent and confident, I’ll feel better about sticking to the plan. Unless I find strong evidence that it’s unsafe, I’ll keep the booking. It’s too late and too risky to change now, and Friend B deserves a well-planned birthday dinner — not chaos because Friend A suddenly panicked."
R_9viZJcOtFe2UMZI,"my immediate gut reaction would be annoyance, because friend A could have brought this up with me earlier. if they brought it up earlier, I could have changed the restaurant or not paid the non-refundable deposit. I'd probably say to friend a 'thanks for letting me know, however this restaurant has great reviews from food critics and I've already paid the deposit. also, there will be no where else to go at this time'. honestly, google reviews seem to be more reliable than food critics, since they may be paid to advertise the business. I would probably check if there are any undisclosed advertisements in the food critic reviews, as well as check whether the negative google reviews have anything in common (food poisoning associated with a specific dish). ultimately, I would keep the booking, because there probably isn't another restaurant open, and I'm annoyed at friend a for only helping at the last second."
R_9qCqgxLFaxmotAR,"I would be annoyed that they ghosted me and felt that they could make judgemental comments about something we were supposed to do together. I would keep these thoughts to myself to try to maintain peace and reply with something along the line of ""I have reviewed comments from food critics and the restaurant is held in high regard. Ive already paid a deposit I cannot get back and it is now too late to change to somewhere else."" I would be concerned if there were numerous recent reviews talking about food poisoning but if the critic reviews were also recent then I would trust them more. If A was so concerned about it (possibly rightfully so, depends on the date of the reviews) then I would happily switch the restaurant if they organized it and refunded me the deposit. I would lean towards keeping the booking unless I'm refunded, and depending on if A apologized for disappearing I might rethink the friendship."
R_4IuXMRl31zVDX2Z,"Three hours before the dinner, and now Friend A wants to raise concerns? Where was this energy when I asked them for help a month ago? I can’t believe they ghosted me back then, and now they’re suddenly worried because of a few Google reviews. This feels so unfair I put in the effort, paid the deposit, and now they want to derail the whole plan. Okay, breathe. Let me look at the screenshots they sent. Yeah, a couple of people are complaining about food poisoning, but I also remember reading reviews from actual food critics who raved about this place. It’s not like every restaurant has perfect reviews even good places can have the occasional bad night. Still, I should double-check. I’ll quickly look up more recent reviews, maybe on a few different platforms like TripAdvisor or even Instagram to see if anyone’s posting about it tonight. Also, I’ll call the restaurant not to cancel, just to ask a few questions casually. Like what their food safety rating is or if they’ve had any recent complaints. If anything seemed sketchy, I’d feel it. As for Friend A, I’m tempted to just ignore the message, but I’ll keep it civil. Something like: “I’ve seen some great critic reviews and checked the food safety rating everything looks good. Given the short notice and non-refundable deposit, we’re still going. I hope you’ll come!” Bottom line: we’re going. Friend B deserves a proper celebration, and this was the best option we had. I’ve done my homework."
R_9f8TBp2vAQXd329,"When I first read Friend A's message, I would be annoyed as she didn't respond to my texts when I asked for her opinion and help which I have to do everything on my own. I would reply to her chats by telling how we already booked the restaurant and that I already search for food critics review before I booked this restaurant, that most restaurants nearby is already full if we cancelled on this one. I would also tell her that I already paid the deposit for this restaurant and that it is non-refundable. If the food critic review is in a form of video in social media, I would send her the link so that Friend A can see, but if it is in the form of text, I would just send her a screenshot of the proof that I researched about the restaurant before booking. I would believe food critics as I am sure that these critics must have tasted every food in every restaurants which I'm sure if they said its good then it must be very good. Eventually, I would keep the booking as most of the restaurants with good food must be very packed already especially for walk-ins."
R_9QLchgtc6B8476G,"A. initially i felt annoyed/frustrated as friend a did not bother to help to begin with and is only mentioning something three hours before the booking when they could have said something earlier B. why did you not respond to my initial texts about the booking / why did you not mention this issue earlier C. determine if food critics were paid to go to the restaurant/leave a review or if they voluntarily went and left good reviews, see the google reviewers history (other ratings they have made) D. check if any other resturant, with better ratings, is available, give friend b options and ask what they would prefer My final choice is keep booking - deposit is non-refundable, friend b would probably feel disappointed if we were not able to get another booking, can avoid dishes that have higher risks of food poisoning/order drinks"
R_93vFP1P8RlZwhtL,"First of all, I will be very unhappy and angry. And I will say to friend A: Why didn't you reply when I was communicating with you? Now that I'm running over here, you're saying that my choice is flawed. If you are not satisfied, you should have communicated with me a month ago instead of now. Secondly, I think although the screenshot of Google's comments has some persuasive power, since I'm not sure about the intentions of friend A, I will check for myself to see if these things actually happened. Personally, I think it might have happened before, but not recently. Finally, my final decision is that if I confirm that there has been a poisoning incident recently, I will go to the merchant to discuss the matter and refund the fee for the reserved position. If no such event has occurred recently, I would choose to keep the reservation. Even if they don't come, I will still go and eat by myself."
R_41Ba1as7ba32vsJ,"I would be pretty pissed off at him since if he wanted to have any input he probably should have said it early like a month earlier knowing my friend hes probably a bum so I know he didn't have anything urgent or anything to attend to. Unless he did though, for example his parents might have gotten into a car crash and died and so he couldn't respond, but still regardless of how traumatic this event was he should still have the decency to respond at least within a month, not just about this dinner but telling me about what happened to him as friends should do. So I'd probably tell him that if he wanted to change the booking he shouldve said something earlier and that me and friend B will be going to this place regardless of if A was coming or not. In regards to the reviews I'd probably think nothing of it as not only am I pissed of at A but you can find anyone saying anything on the internet, and so i would keep the booking."
R_9Z7mlqmSLzfiFhf,"I already paid the deposit, why is A telling me just now, why didn't A respond to my messages earlier when I needed them to? And A is just telling me now? That is not going to help the situation at all. So now if we actually don't go, either A and me split the deposit price and we go to a new place or we just go to the place I picked. But food poisoning is dangerous and the reviews food critics gave might have been biased. It's quite risky. I also should've checked the Google Reviews before I booked. That's my mistake. Maybe we should also consult B and see what they say. But I am still annoyed at why A stopped replying and is only saying all of this now. Where was A when I needed them? Final choice is to change plans because it is B's birthday and it is not worth it the risk."
R_41yLbDAOwRjV9ZD,"My immediate gut reaction would be shock at the news and annoyance/confusion at why the friend responded after so long. I would immediately research to try and see if these reviews are authentic or not and contact the restaurant directly to ask about this. I would also check online on social media. If it's true, I would demand a refund for the booking. What I would mention to the friend is the high rating from food critics and ask why they haven't responded for so long/if everything is alright with them. I would also check in with Friend B first to make sure they can come. My final choice would depend on whether the reviews seem trustworthy and what the restaurant says when I call them. This is because I don't want to have wasted my money as it's not refundable but want to take my friend's text into consideration just in case it is true."
R_9AMDoqFupvbMn0u,"(There's probably a typo? As we received the message from A instead of B, my response will be under the circumstance of where the message comes from A instead of B) I would be disappointed and displeased as I'm about to lose money when I first received A's message. I would then check the google review myself to see how recent the food poisoning occurred. If it happened within this week, I would suggest eating takeout at whoever's house, if not I would try to convince them to go. I would overall try to keep the situation light as its B's birthday and I do not want to cause any tension. So I will probably respond with a surprised emoji. Regarding A's lack of response a month prior I would no longer ask for their opinion and instead take full control of the situation. Overall, I will change plans for us, as I don't want my friend risk to get diarrhoea on their birthday. But because I don't want to waste money, I would check if I can change booking date and go by myself some other time."
R_9FM1heUaLdVQUsx,"My immediate reaction is that friend A shouldnt have an opinion. if I planned it all myself and they dont like the restaurant they shoudlve said something earlier. however, if they hold that opinion strongly id just reply saying i already paid the deposit and if they really want something done then they can pay the deposit and find a new place. i would trust their information if its in a screenshot like theres no reason i shouldnt but then i would go check myself. i would look the restaurant up to see if there are bad reviews and then be like oh i actually found these ones theyre mostly good if they are. i would decide to keep the booking unless the friend wanted to pay the deposit i already paid and wanted to find somewhere else. id probably explain too that most of the review are good and itll be okay anyway."
R_9IYl1rZSCRvKRkD,"I would be frustrated at friend a, as they made no help to make plans and have now decided to suggest something different, after a nonrefundable deposit. I would say to friend a that I had only heard good stuff and seen really good reviews, that a nonrefundable deposit was paid and that they should have said something earlier. I would go and check reviews myself. depending on reviews I would most likely keep the booking as it is meant to be good and is non-refundable."
R_4jBC0qyqsZWEaQL,"I would be very angry, firstly, I picked the venue and paid for it. Further, not replying to someone's message is rude in my opinion, and I am booking the restaurant for them. I would probably say to my friend A, Please pick a restaurant yourself. I would read the reviews of the restaurant again. If there is only one review, then it should be a chance event; if there are more than three of this kind of review, then I think I would consider it. Also, if there is other software, I would check the reviews. Before making a final decision, I would ask my friend B's opinion, as it's his birthday, if he wants to be at this restaurant, he doesn't have to make a change, if he wants a different one, let him choose. After the discussion with B, I will decide whether to keep the booking or change the plan, and if I do change the plan, I will most likely leave them to their own choices and booking."
R_4fEgJqtJj1UGFQQ,"A. confused B. ask him why he took so long to reply C. decide on the overall rating of reviews D. ask a friend or family who has been to the restaurant about their experience. Keep the booking, as I was forced to decide alone."
R_4hA67MOCRzYcpR4,"Upon reading Friend A's message, my immediate gut - reaction is one of annoyance. I mean, where were they when I was struggling to find a restaurant on my own after they ghosted me? Now, just three hours before the dinner, they pop up with this alarming news. Right away, I'd be tempted to text Friend A back saying, ""You went radio - silent on me when I needed help, and now you come up with this? How reliable are these Google Reviews anyway?"" I'm skeptical because I remember the restaurant has great reviews from professional food critics. Food critics usually have more in - depth knowledge and experience in evaluating restaurants compared to random diners on Google Reviews. To decide which information is trustworthy, I'd consider the source. Food critics are likely to have visited the restaurant, tasted the food properly, and made a more objective assessment. On the other hand, Google Reviews can be subjective, and it's possible that those who claimed to get food poisoning had other factors contributing to their illness. Before making a final decision, I'd do some extra checks. I'd try to find more recent reviews on other platforms like Yelp or TripAdvisor. I'd also look for any official health inspection reports of the restaurant. If I can't find any red flags from these additional sources, and considering that most nearby venues are full, I'd probably stick with the original booking. After all, I've already paid a non - refundable deposit, and the positive reviews from food critics give me some confidence in the restaurant's quality."
R_4NwhRxEgkSXBV03,"A - thats so annoying i need to find a new restaurant now and ugh my money, why didnt they tell me this before i made a deposit but it is what it is i guess B - id be annoyed at them but id be like oh ok and try to get them to help me find a new place and then just be annoyed at them later C - i would trust them i dont think thered be any reason for me to not D - id tell other people about the inconvenience it was change plans because i dont want people to get sick"
R_9Brhp62AwtSXskk,"I would be annoyed at Friend A for trying to help minute. Afterall, the two of us were supposed to be looking for a restaurant together. If Friend A helped from the beginning, maybe we would have had more information. I would say to Friend A to why he or she was not responding to my messages and all of a sudden you decided to do all this research three hours before the dinner. I would clearly the fault in the lack of effort to try and help yet still have the time to do research and criticize that restaurant I chose. Nevertheless, the dinner is in three hours so I would have to make a decision to either push through with it, reschedule the dinner, or settle for a different restaurant. I would carefully investigate the negative review if it were 'rage bait' or legitimate. I would inspect the review for any exaggerations or extreme biases without any evidence and inspect the person who gave the review. Despite the possibility of food poisoning, I would still push through with the booking since I food critics are more credible sources of information and hope that we won't get food poisoning."
R_9gSCcbS1E3C8iTw,My immediate gut feeling is betrayal but I could consider what my friend is saying. I would say to my friend that I would have appreciated if you would let me know earlier about the reviews. I would look at Google Reviews as they are from people who are not professional so they represent normal diners.
R_9eahWs8Qec76gmd,"When I read Friend A’s message, I felt extremely annoyed and angry. I couldn’t believe they waited until three hours before dinner to bring this up, especially after completely ignoring me when I asked for help weeks ago. If they were so concerned about food safety, why didn’t they say something earlier or better yet, book the restaurant themselves? I would reply right away with something like, “Seriously? You had one job, and you ghosted me when I needed help. Now that I’ve done everything, suddenly you care? If you’re so worried, feel free to find another place yourself. I’m not doing it again.” To be sure, I would contact the restaurant to check if there were any recent food safety complaints. I’d also look at the reviews carefully when were the food poisoning claims posted? Are they verified or just random angry customers? In the end, I would keep the booking. It’s too late to change anything, the deposit is non-refundable, and I already took responsibility when A didn’t. If they don’t want to come, that’s their choice but I’m done handling things for them."
R_962o5xFSw9PbNFZ,"That any place may a food poisoning problem on a random night, and since other places are booked we might as well eat there. I'd say to friend a to not worry and to bring the review as a screenshot to the restaurant.I'd message or call any people I personally know who have eaten at the restaurant for real reviews. I would keep the booking as any place may make a mistake leading to food poisoning, personally I'd eat a steak and ask them to be sure its cooked to my liking, showing them the review and maybe even speaking to the manager on shift before ordering to let them know of the issue in hand."
R_9I5GBWmOLvqXYfX,"I already paid the non-refundable deposit for the booking and food critics have highly rated this restaurant. As with all restaurants, not everyone will have the same dining experience due to a number of variables. Friend A was meant to help out but did not help with choosing the restaurant in the end so Friend A does not get a say in deciding which restaurant to go to. While it is an annoying situation, we are already committed to this restaurant because no one else helped in deciding where to go and I have already incurred a cost in the non-refundable booking. Friend B trusts me enough to allow me to book the restaurant for their birthday, so the only reason for me to change plans is if Friend B tells me so, otherwise we keep the booking despite Friend A's late objection."
R_9qeyHfp7rwmBIii,"Ugh, you’ve got to be kidding me. Three hours before dinner and now Friend A suddenly cares? Where was this energy when I asked for help a month ago? I chased them up, they ghosted me, and I ended up doing everything myself; finding the place, reading reviews, paying the deposit out of my own pocket. And it’s non-refundable too. I remember this place had a good write-up in that food magazine and most of the Google reviews were fine. There were a couple of bad ones, but seriously, every restaurant has a few horror stories. It doesn’t mean it’s a death trap. Also, even if we wanted to change restaurants now, it’s a Saturday night. . I get being cautious, but this just feels like them trying to avoid responsibility again. Honestly, unless someone else wants to fork out hundreds of dollars for a new place and sort a backup plan within the next hour, we’re sticking to the original restaurant. I’m not throwing away the effort I put in or the money"
R_4OUZZKs5XdB6yKX,"In this scenario, I would find Friend A to be quite inconsiderate. My first course of action would be to message them, explaining my perspective of the restaurant having good ratings, as well as a non-refundable deposit. I would also explain that given Friend A's poor response time it was all I could find by myself on short notice. I would then go back over reviews of the place to find evidence supporting my claims around food critic's perspectives and send these to Friend A. I would also then look to see which reviews aligned with their perspective of giving food poisoning and take note of which dishes to potentially avoid to put Friend A's mind at ease. I would choose to keep the booking plans as Friend A should've been more proactive in finding places to book and communicating if they did not want to go to this restaurant."
